,0
134,"Fellow Malawians, we all can see that the main problem in Malawi is not inadequate resources but corruption and excessive and expensive entitlements of senior public officers. Fighting corruption must be a top priority for a government. That is not the case unfortunately. Some of the reasons corruption is not ending include the expensive type of political campaign and the parasitic political party system. Statistics confirm that Malawi is a least developed country hence it is a country whose people are poor and by extension, a country whose politicians are poor. The type of political campaign that is practiced is expensive and breeds a fertile ground for advance State capture by those who bankroll the campaign. Corrupt business
people finance greedy politicians in anticipation of easy access to business contracts once the politician or political party is in power. This is what has sustained State capture."
135,"In State capture, the loser is the citizenry. Politicians influence award of government contracts to corrupt business people at inflated prices. The inflated prices are because the corrupt business people want to i) recover the money they spent to bankroll campaign, ii) sell the goods and services at a profit and iii) give part of the payment to the politicians so they remain connected. When the politicians get part of the payment they use part of the money for their personal projects and part of it for campaign materials and other political expenses. That is why the fight against corruption cannot be won if we continue using the same political campaign model. In fact, there are politicians who have established businesses out of money acquired in this way. Their businesses get contracts from the same government they stole capital from. In other words, our tax money has become business capital for greedy politicians and the businesses get contracts from government where they are paid by our tax money again. This is the height of impunity in Malawi. We all have a responsibility to stop this."
136,"My fellow Malawians, let me illustrate how corruption causes poverty. Suppose there was money enough to construct three school blocks but due to corruption the price is inflated and the money can only construct two school blocks. Suppose each school block has two classrooms that can accommodate 60 learners. Further, suppose constructing a school block offers job opportunity to ten people as bricklayers, carpenters and others. By constructing two instead of three school blocks because of inflated prices, the results are as follows"
137,"Three blocks would have made 360 learners move from learning under a tree to a proper classroom, but due to corruption only 240 learners will be in a good classroom. The other 120 learners will continue learning under a tree yet money was available to put them in a good classroom."
138,"Constructing three school blocks would create employment opportunities to 30 people. By constructing two, it means 10 people who would have some work to do still have no job."
139,"Since there is corruption, there is high likelihood that the two school blocks may be of substandard quality. They may need maintenance quicker than if construction was not marred with corruption. Additional resources are likely to be spent to rehabilitate the same school blocks when the resources would have been spent on other functions."
140,If children are learning under a tree; if there are no drugs in health facilities; if there are no all-weather roads in some areas; if jobs are scarce; if we Malawians are poor; one of the main causes is corruption.
141,"Our approach to the fight against corruption starts from the process of getting into office. We will not do the traditional political campaign you have known. We will not do because we do not want to get money from corrupt business people so that when you vote us into office we serve them instead of serving you, Malawians."
142,"We will not form a political party because it is an expensive organization that contributes to temptation of political leaders to indulge in corruption and when in office, abuse public resources to fund the political party. You can relate this to some of the revelations that are coming out now of how public institutions financed activities of a political party. We do not want to tie ourselves to the yokes that have chained the others. More importantly, not forming a political party means that there will be no group of people (members of the ruling party) that feels and behaves as more important than the rest of Malawians. Between me and the public service, there will be no person or group of people to terrorize public servants on the premise that they are the ruling party members."
143,"It is not an exaggeration to say that political parties have been a disuniting factor so far in Malawi as they have been catalyst for tribalism and nepotism. You may appreciate the observation that in some political parties, it does not matter how loyal and qualified a member is, if they do not come from a particular region or from a particular tribe they cannot be voted president of a party to have a chance to contest as president of a country. We must for a moment dismantle this construct and create a political system that gives hope to every Malawian everywhere that they can be anything including President of Malawi if they work hard, have qualifications and have the integrity to serve their nation. I am convinced that being a president without a political party will foster nation building."
144,"Additionally, as your leader, I will have all my focus on running government, rather than divide my focus between running government on one hand and running a political party on the other hand."
145,"Fighting corruption is a war. Being a war, it needs troops who are loyal to their nation, troops who are well-trained and well-resourced. Above all, troops who are best commanded. The agencies responsible for fighting corruption are the troops. The President is the commander. Like in a military war, if troops are compromised, it is difficult to win the fight against corruption. If the commander is compromised, it is impossible to win the fight against corruption."
146,"For the reason that we will not get into office through a corrupt process, you can be assured that my team and I will fight against corruption decisively for we will not be haunted by our own involvement in the same. I will take it my prime responsibility that the fight against corruption is ably commanded and that if there are elements of compromised loyalty in the troops, I take corrective measures. I can guarantee that under my stewardship, no effort will be spared to fight corruption."
147,The future of Malawi leadership
148,"Fellow Malawians, I understand the frustration among well-meaning Malawians. I am aware that some of you have lost interest in voting in next election because we have been disappointed by the political administrations we have had. I come to give hope. I come to restore the courage we always have had, believing that as citizens, power is in our hands to make a leadership that has i) integrity, ii) technical and administrative competence and iii) desire to serve."
149,The 2025 presidential election will be a ‘referendum’ - a choice between maintaining impunity versus ending impunity; a choice between maintaining mediocrity versus a launch of meritocracy; a choice between politicians versus leaders.
150,"To echo the words of Barack Obama, former President of the USA, “we did not inherit the country from our ancestors so we can feel a sense of entitlement, rather we borrowed it from our children and the generations to come and therefore we have an obligation to hand over a better country to them”."
151,"We have a responsibility to change the narrative that politics is for the few rich Malawians more so those getting rich through corruption and theft of public resources. We have a duty to change the narrative that politics is for crooks, liars, the incompetent and that politics is risky."
152,"My colleagues and I are at your service and are determined to make personal sacrifices for the sake of presenting a real choice to you in the next elections. We come so that as voters you are not faced with a choice between lemons and grapefruits (manyumwa), for both are sour. We come to be your real choice. We know the contenders are heavily armoured with resources, including those they stole from our taxes."
153,"We are armoured with faith. We believe we shall succeed with your support. We are ready to govern and to do so competently. I have the right training, experience and exposure to public policy to competently develop the economy and run the public service. As you may appreciate, the duty of any government is two-fold; i) to develop the economy with the aim of improving people’s living standards and ii) to manage the public service so it can deliver public goods and services to people professionally, efficiently and effectively. I promise to deliver on these two cardinal roles in an excellent manner."
154,"I appeal to you Malawians to support my candidacy. I am ready to serve you. In a special way, I encourage the youth to take 2025 election as uniquely important for I, one of their own, will be on the ballot paper. I am going to run the government in ways that will prove that the youth in Malawi are ready for the task. I will take it my additional responsibility to bring public confidence in the youth and in doing so clear a way for all youth who seek elected positions. I promise a government that will be at your service. I promise an administration that will be the moral campass of the nation."
155,"Let us together make 2025 election a turning point for Malawi. Let us together uproot the breed of corrupt, incompetent and nepotistic politicians and plant a new breed of leaders that will be a symbol of integrity, competence and service. As late Lee Kuan Yew, founding Prime Minister of Singapore said, “we need the best and ablest in politics, not charlatans with a gift of the gab”. Let us together sanitize politics in Malawi. Politics will become clean when clean people replace the dirty ones who have made it dirty."
156,"I am appealing to every Malawian to engage our conscience and think of a Malawi we would want our children and grandchildren to live in. It does not matter what our current position is, what matters is the responsibility we have to ensure we hand over a better country to our children and grandchildren. You may be a serving member of the cabinet, an advisor, a senior public officer, a political party member who genuinely believes things are not the way you would have wanted to serve the nation. I ask you to support my candidacy. Tell your family and relatives to vote for me in 2025 presidential election."
157,"I request you all who are in support of my candidacy to convince others around you. Convince your family members, your village mates, your village head leaders.Tell them the candidate of choice in 2025 presidential election has been identified and he is Milward Tobias. That will be your greatest contribution to my campaign."
158,"To my colleagues; the road will be tough but we are ready for it and we will succeed. We will succeed because we are carrying the hopes of many Malawians who have been yearning for a leadership that can serve them, not one that serves a small group and corrupt business people. Malawians are looking for a leadership that has the integrity to tell the truth, to be accountable and transparent and to develop Malawi. It is high time Malawians became proud again of being Malawian."
159,"Some people will discourage us, despise us and all sorts of negatives. That must encourage us. They will attack us because we are a serious contender. We must remain focused on our mission. The rebuilding of Malawi requires our resilience. We are the team to lead in rebuilding Malawi."
160,"Fellow Malawians, we will campaign as Nzika Coalition and I will contest as an independent candidate. Nzika Coalition means the coming together of ordinary citizens and all well-meaning Malawians as opposed to coalition/alliance of politicians or political parties. Our pillars are i) integrity, ii) competence and iii) service. Our slogan is ‘My vote My destiny’."
161,"Time flies, next elections will come soon, let us pray to God to give us life, courage and protection. Malawi will rewrite her history."
162,God bless us all! God bless Malawi! Thank you very much!!
163,"Group village head Kambiri said apart from improving yield and nutrition in his community, Trade programme will also protect farmers from unscrupulous vendors who exploit them."
164,"In the Central Region, we are promoting soya bean, groundnuts, sunflower and potato and in the North we are focusing on honey and beef."
165,"The minister told the House through the budget, the government was hoping to implement policy reforms that enhance resource mobilisation accompanied by prudent expenditure management to ensure that the country’s debt is put on a downward trajectory."
166,"The minister reported that during the 2022/23 financial Year, government constructed community technical colleges in Nkhotakota, Chikwawa, and Chiradzulu."
167,But who made anyone an expert in matters of the heart? Who are we to judge what or who anyone decided to fall in love with? Do we know what attracts people to each other? Do we even understand how they met or their circumstances herein? Do we even know what binds the two?
168,"Mr Hwesha , a primary school teacher for EUTHINI zone being beaten by his own father because of stealing his cattle and selling them . Cattle recovered and now at Mzimba police."
169,"Msume says, Cosmos, has on Monday pleaded guilty to the theft charges before the court of law."
170,"Minister of Homeland Security, Ken Zikhale Ng'oma, has donated his net salary for March, which is K1.5 million, to young men (adzukulu) who worked to rescue others during the disaster."
171,"Since then, they have not set foot in South Africa after a warrant of arrest was issued against them."
172,He says it is sad that Malawi is yet to reach 500 megawatts as its national capacity.
173,"""We have leant big lessons that we made a big mistake in 2016 and its high time we revisit the Electricity Act,"" He said."
174,"She said: “To achieve that, we are promoting dairy farming in the South."
175,Mphonda added that they expect to recruit new contractors to finalise the works.
176,"The project, valued at K650 million, was scheduled to be completed in 2022, the website further says."
177,"While others are trying everything possible to unite and at least speak with one voice, there is one person who thinks this moment is all about him—former president Peter Mutharika."
178,"“Currently, we are only issuing passports to those who have got emergencies such as medical evacuation, government trips and students flying out for studies,” he said."
179,He said a passport is a right for every Malawian and it is not something that people should treat as luxury.
180,We promise to handle your information with care
181,"Sorry, something went wrong"
182,"Speak up, contribute here!"
183,"If you know someone with heart problems, please inform them. This is for free."
184,"Good morning friends. Queen Elizabeth Central Hospital will be receiving Cardiologists who will treat patients with heart problems from 8th May to 13th May, 2023."
185,People will judge me and say what they want to say but I believe only God has the final say.
186,Martse died last year after succumbing to fire burns.
187,The council has since issued Nyirenda with a warning letter.
188,Stay calm.
189,Answer me.
190,"You can dance, can't you"
191,I passed by her house yesterday
192,He is fluent in French.
193,Tom asked me what I had been doing
194,A girl in karate uniform breaking a stick with a front kick.
195,People are fixing the roof of a house
196,A group of people standing in front of an igloo.
197,A man in a vest is sitting in a chair and reading a magazine
198,There are many people standing outside of a building.
199,A teenager plays her trumpet on the field at a game
200,The young lady is looking at the pizza
201,He never mentioned that journey .
202,"After two years in hiding , my grandfather appeared in London ."
203,He was never right again .
204,"Now , we follow state and local regulations ."
205,You can do a lot of things
206,"So I immediately called her up , of course"
207,This is very promising .
208,"I mean , at the end , will he be able to work ?"
209,This is why we are here .
210,"When we give people the opportunity to cheat , they cheat ."
211,"Do I have a place , a venue , in mind when I write ?"
212,This is the enemy .
213,Just people sending their pictures .
214,"And when you turn the switch off , the light goes off ."
215,Some drivers feel its not fair that some traffic can go through while they have to wait. Something has to be done before things turn violent
216,I'm angry.
217,I'm broke.
218,I'm obese.
219,Ignore it.
220,Keep warm.
221,She smiled.
222,Who's that?
223,I saw a dog.
224,No means no.
225,Tom was charged with drunken driving after he was involved in a car accident in Boston.
226,Tom's reached a point in his life where he has to make some pretty important decisions.
227,"When the rock singer appeared on the stage, the audience at the concert clapped loudly."
228,Who am I? Where do I come from? Is there life after death? What is the meaning of life?
229,Why don't we have enough food for everyone? I thought you went shopping this afternoon.
230,Amnesty International often organizes public protests in support of political prisoners.
231,"Before we get started, I'd just like to say a few words about how important this job is."
232,"Eat a live frog every morning, and nothing worse will happen to you the rest of the day."
233,I appreciate it when a native speaker tries to help me sound more like a native speaker.
234,I had to change clothes because what I was wearing wasn't appropriate for the situation.
235,"I used to think that only bears hibernate, but the teacher said that turtles do as well."
236,"If I can get a book from the library, it saves me from having to buy it in the bookshop."
237,"In retrospect, Tom realized he shouldn't have been dating both sisters at the same time."
238,It was boredom that Aldous Huxley considered one of the most dangerous human conditions.
239,"Originally, Abraham Lincoln wanted all slaves to be deported to Africa or the Caribbean."
240,"Sometimes, it's hard to tell when Tom is being serious and when he's just joking around."
241,The Japanese pay more attention to the group or the organization than to the individual.
242,The first thing we should do is write and thank your brother-in-law for his hospitality.
243,The point of true mutual understanding has not yet been reached between Japan and China.
244,The understanding of the present is impossible without a good understanding of the past.
245,Tom leaned out the window of his car and pressed the button on the intercom at the gate.
246,Tom loves coming here since he thinks this place serves the only fast food worth eating.
247,"Tom wanted to give you a surprise party, but I knew you'd hate it, so I told him not to."
248,Tom was drinking at a bar with Mary at the time the police think that John was murdered.
249,What surprised me most about that accident is how fast the lawyers arrived on the scene.
250,"When darkness falls, the baboons return to the trees to sleep, safe from night prowlers."
251,"When you get married and have kids, you'll realize that actions speak louder than words."
252,"Whenever you find yourself on the side of the majority, it is time to pause and reflect."
253,Almost everyone in the class voted in favor of having a thank-you party for the teachers.
254,"As the iron was heating up, Mary poured distilled water into the reservoir to make steam."
255,"Because of the problem of air pollution, the bicycle may some day replace the automobile."
256,Do you know the reason why two-thirds of the students did not attend the student meeting?
257,English is quite often the language of choice when speaking to an international audience.
258,"I had an appointment at 2:30, but I got caught in traffic and couldn't get there in time."
259,"If I can get a book from the library, it saves me from needing to buy it in the bookshop."
260,It is illegal in the United States for law enforcement to use torture to get information.
261,"Louis Braille, who was blind from the age of three, invented a way for the blind to read."
262,"Mary's not the first woman to fall in love with a married man, and she won't be the last."
263,Police immediately sealed off the streets around the hotel as they searched for the bomb.
264,The black and white bears living in the mountains in China and Tibet are called 'pandas'.
265,The police found Tom lying on the floor with a bullet hole in the middle of his forehead.
266,The politician said he was deeply indebted to everyone for their support in the election.
267,"They say that in America anyone can become president, but perhaps that's not really true."
268,Tom and Mary gave exactly the same answers on the test which made the teacher suspicious.
269,"Tom and Mary were speaking in French, but switched to English when John entered the room."
270,"Tom ate at a new restaurant the other day, but he doesn't remember the restaurant's name."
271,"Tom has always maintained that he is innocent, and claims to this day that he was framed."
272,Tom killed Mary because he found out she had started the fire that had killed his family.
273,"Tom told Mary that he was going to kill himself, but he didn't have the courage to do it."
274,"Tom, Mary, John and Alice are friends. They've known each other since they were children."
275,"When I got my driver's license renewed, I had to decide if I wanted to be an organ donor."
276,"When someone speaks with such rhetorical flourish, it starts to sound like they're lying."
277,"According to this magazine, the economic situation in Japan is getting worse year by year."
278,"Although most islands in the ocean have been mapped, the ocean floor is generally unknown."
279,"Among the wind instruments, the aboriginal didgeridoo made of eucalyptus was his favorite."
280,"Due to unforeseen circumstances, our trip to the mountains this weekend will be cancelled."
281,"Even though Tom was brought up in the country, he loves the hustle and bustle of the city."
282,"Happiness depends, not so much on circumstances, as on one's way of looking at one's life."
283,"History is like a waltz, eternally following the three steps of war, peace and revolution."
284,I began driving our tractor when I was 12 years old to help my father out at harvest time.
285,"I don't know what went on last night, but they're not speaking to each other this morning."
286,I don't think it's always right for local governments to submit to the central government.
287,I'm a non-native speaker of English and realize there is a lot that I still need to learn.
288,I've heard that you don't eat green leafy vegetables. You say that it is food for animals.
289,One out of 455 women doesn't realize she's pregnant until the twentieth week of pregnancy.
290,Some of Martin Luther King's supporters began to question his belief in peaceful protests.
291,The names of the students who failed in the examination were posted on the bulletin board.
292,To reduce misunderstandings we should learn the techniques for communicating successfully.
293,Tom asked Mary about the traffic accident she was involved in when she was five years old.
294,Tom felt a little uneasy as he walked down the deserted street in the middle of the night.
295,Tom has enough money to buy any computer in this store. He just needs to decide which one.
296,You're the only person I know besides me who is actually interested in this kind of thing.
297,A study found that almost 10% of men were obese in 2008. That was up from about 5% in 1980.
298,"Do you swear to tell the truth, the whole truth and nothing but the truth, so help you God?"
299,"Esperanto, Ido, Interlingua, Klingon, Lojban, Na'vi and Volap√ºk are constructed languages."
300,"Good friends are like stars. You don't always see them, but you know they are always there."
301,"If you concentrate all your energies on the study of English, you will master the language."
302,"In January of that year, we saw snow for four days, from the fourteenth to the seventeenth."
303,It is because light travels faster than sound that we see lightning before we hear thunder.
304,It is difficult to overcome this shortcoming without drastically changing the whole system.
305,"My grandfather does moderate exercise every morning, which is why he is strong and healthy."
306,"Often, the less there is to justify a traditional custom the harder it is to get rid of it."
307,"She asked him out on a date, but he said no since he thought girls should not ask boys out."
308,The best parents of all are those who allow their children to follow their natural talents.
309,The only thing on the table that I normally wouldn't eat is that stuff on the yellow plate.
310,"Then he got dressed, stuffed his lecture notes into his briefcase, and ran down the stairs."
311,"There are times when you need to fight for what's right, even at the risk of your own life."
312,Tom began working as a volunteer at the homeless shelter while he was still in high school.
313,Tom has a framed photo of his parents on their wedding day hanging on his lounge room wall.
314,Tom makes way too many snide remarks. That's perhaps why he doesn't have very many friends.
315,"When Tom looked down at the apple he was eating, he realized that he had eaten half a worm."
316,"When poverty comes in the door, love flies out the window is a saying as old as it is sad."
