,0
317,"A doctor can bury his mistakes, but an architect can only advise his clients to plant vines."
318,"After I graduated from college, I moved back home and lived with my parents for three years."
319,"Even though my friend was a vegetarian, I didn't tell him that the soup had some meat in it."
320,"First I'll look at the prices, and only then I'll decide whether I'll buy the camera or not."
321,"For the other 600 million people, English is either a second language or a foreign language."
322,He was looking forward to spending the weekend with her in their little cottage in Somerset.
323,"If you say exactly what's on your mind all the time, you're likely to upset a lot of people."
324,It's not right for you to do something bad just because someone else has done something bad.
325,"Lonely people tend to be afraid of meeting others, which ensures they will always be lonely."
326,Mary is really great. She cooked a wonderful meal for me and even washed the dishes herself.
327,Mary traveled into the future and found that climate change had destroyed all life on Earth.
328,One thing Tom does that isn't very safe is that he uses the same password for every website.
329,"She asked him to help her father clean the garage, but he said that he was too busy to help."
330,"The Democrats haven't decided on their candidates yet, but in any case they're sure to lose."
331,The area of a triangle is half of the area of the rectangle with equivalent base and height.
332,The police found boxes that contained marijuana and other drugs inside the trunk of the car.
333,They took Tom to the hospital to have his stomach pumped because he ate something poisonous.
334,"Tom can't remember all his passwords, so he keeps them in a list disguised as phone numbers."
335,Tom has to be careful about what he eats at restaurants because he's allergic to many foods.
336,Tom lost the shopping list his mother had given him and just bought things he wanted to eat.
337,Tom pleaded guilty to drunken driving and his driver's license was suspended for six months.
338,Tom thought it was a good idea to take advantage of the opportunity that Mary had given him.
339,"Tom thought the music was too loud, but he was too tired to get up and turn the volume down."
340,"Tom thought where he put his gold coins was the perfect hiding place. However, he was wrong."
341,Tom told Mary that he wouldn't be able finish the job in the amount of time she'd given him.
342,Tom was impeccably dressed and well prepared for his job interview with the finance company.
343,"When I got out of jail, the first thing I wanted to do was to eat at my favorite restaurant."
344,"While cleaning my room yesterday evening, I happened to find an old photograph of my mother."
345,Worrying is like a rocking chair; it gives you something to do but doesn't get you anywhere.
346,I don't think it makes him a bad person just because he's decided he likes to eat horse meat.
347,I have recently used the services of his travel agency to book a cruise in the Mediterranean.
348,I just want to let you know that I think you're the most beautiful woman that I've ever seen.
349,I never thought this rubber band would come in handy when I put it in my pocket this morning.
350,"In some areas of the world, you can still get sued if you slander or libel a deceased person."
351,"No matter how carefully you choose your words, they'll always end up being twisted by others."
352,"She bought him a car, but he didn't have a driver's license so he couldn't drive it anywhere."
353,Tom and Mary were snuggled up to each other and Tom was whispering something into Mary's ear.
354,"Tom would have liked to attend Mary's party. Unfortunately, he had other things he had to do."
355,We keep our most interesting thoughts and the most interesting side of ourselves hidden away.
356,"Considering all I've eaten all day is just one slice of bread, I'm not really all that hungry."
357,"I have the afternoon off today, so I plan to go to the park, sit under a tree and read a book."
358,"I realize that this may sound crazy, but I think I've fallen in love with your younger sister."
359,I think Tom is going to be pretty mad when he finds out that the painting he bought is a fake.
360,"I think if I talked more often with a native speaker, my English skills would improve quickly."
361,"I tried explaining the algebra homework to him, but it just went in one ear and out the other."
362,"If the universe is full of stars, why doesn't their light continually light up the entire sky?"
363,"If we were supposed to talk more than listen, we would have been given two mouths and one ear."
364,"In conversation, one is likely to find out certain things about the other person quite easily."
365,It's my fault that the cake was burned. I was talking on the phone and didn't notice the time.
366,It's no use confessing your sins to the priest if you don't think twice before repeating them.
367,"Money can't buy happiness. However, it's more comfortable to cry in a Maserati than on a bike."
368,That knife was so blunt I couldn't use it to cut the meat so I had to rely on my pocket knife.
369,This note summarizes some information that we hope to discuss at the meeting in San Francisco.
370,Tom called Mary to ask her whether she wanted him to buy some bread on his way home from work.
371,Tom told the children that they could stay in this room as long as they didn't make any noise.
372,Tom wished he had had the courage to jump into the river and save the baby that had fallen in.
373,Tom's an irritating person to work with because he'll never admit it when he's made a mistake.
374,"When we are away from home, nothing gives us more pleasure than to receive a parcel from home."
375,"As soon as I can get my son to scan our family photos, I'll upload some of them to our website."
376,"For some reason, people have been avoiding me like the plague ever since I got back from India."
377,It wasn't until long after they got married that Tom found out that Mary was wanted for murder.
378,Mary waited years for Tom to get out of prison and was very happy when he finally got released.
379,Never work on electrical wiring without unplugging it; it's a bad idea. I know from experience.
380,"Professional translators quite often specialize in just one field, for example law or medicine."
381,The bursting of Japan's so-called bubble economy sent shockwaves through international markets.
382,"Tom could hear a commotion in front of his house, so he went outside to see what was happening."
383,Tom wondered how many times he'd have to tell Mary to clean her room before she finally did it.
384,"We have considered your proposal, and we have decided that we are not able to reduce the price."
385,We humans have a great way of twisting facts to fit our conclusion as soon as we have made one.
386,"When he left the Army, Roger Miller moved to the home of country music in Nashville, Tennessee."
387,"When out at sea, to keep the fish that is caught from spoiling, it is immediately refrigerated."
388,"When the train goes through the station, the windows rattle noisily and the whole house shakes."
389,"You mustn't think only about your job, you must also think about the importance of your family."
390,"According to the old man I met yesterday, cockroaches can be eaten and don't taste all that bad."
391,"After Tom had eaten all the popcorn in the bowl, he went back into the kitchen to pop some more."
392,"Although he had fewer supporters among the governing class, he was able to get the popular vote."
393,"Cesar Chavez died in 1993 at the age of sixty-six. More than 40,000 people attended his funeral."
394,"Don't worry. He may look intimidating at first glance, but he's actually a very friendly person."
395,"I thought a bunch of people would go water skiing with us, but absolutely no one else showed up."
396,"I thought doing this would be easy, but we've been working all day and we're still not finished."
397,"If you want to change the world, start with the person that you see in the mirror every morning."
398,Investment in education is undoubtedly the only effective way to bring a country out of poverty.
399,It is needless to say that an experienced person will do better than someone without experience.
400,It's a lot less likely for a Macintosh computer to have a virus than a computer running Windows.
401,Most people say that the best way to learn a foreign language is to learn from a native speaker.
402,"Since I haven't received an answer, I was wondering if maybe my mail never got delivered to you."
403,"The ability to work hard is an admirable quality, but the ability to relax is equally important."
404,"The most interesting information comes from children, for they tell all they know and then stop."
405,"Tom said that he doesn't want to hurt you, but if you come around here again, he'll beat you up."
406,Tom says he can't understand how Mary manages to make so much money working only one day a week.
407,Carbon monoxide is a poisonous substance formed by the incomplete combustion of carbon compounds.
408,He is usually straightforward and sincere and thereby gains the confidence of those who meet him.
409,"Monday, Tuesday, Wednesday, Thursday, Friday, Saturday and Sunday are the seven days of the week."
410,"Roger Miller learned to play the guitar and the violin. Much later, he learned to play the drums."
411,"She advised him to visit Boston, because she thought it was the most beautiful city in the world."
412,"Tom gave a famous singer ten thousand dollars to come to the restaurant to sing ""Happy Birthday."""
413,Tom left the milk unattended on the stove and it boiled over and went all over the kitchen floor.
414,"When you have eliminated the impossible, whatever remains, however improbable, must be the truth."
415,"Foods rich in vitamin E include dark-green, leafy vegetables, beans, nuts and whole-grain cereals."
416,"From personal experience, I know that any encounter with him will leave a bad taste in your mouth."
417,Give a man a fish and you feed him for a day. Teach a man to fish and you feed him for a lifetime.
418,His novel ideas are time and again getting him into trouble with his more conservative colleagues.
419,I heard that one way to stay healthy is to avoid eating any food with unpronounceable ingredients.
420,I think it's unlikely that the next version of Windows will come out before the end of this month.
421,I've kept my weight down even though many of my friends have gained weight as they've grown older.
422,The boy I saw searching through the garbage can said that he had not eaten anything for four days.
423,Tom told Mary that he thought a hippopotamus could run at a speed of about 30 kilometers per hour.
424,Yesterday the unveiling of the founder's statue and the opening of the school building took place.
425,You know that your English is good when people stop complimenting you on how good your English is.
426,"Even though Tom begged Mary not to go, she left with the children and went to live with her mother."
427,"I can't change the direction of the wind, but I can adjust my sails to always reach my destination."
428,"I don't like snack bars. They're expensive, noisy, and full of the smell of tobacco and fried food."
429,"I've got a squeaking noise in my brand new car, and do you think I can find where it's coming from?"
430,"Scientists continue to discover new medicines, so there is always hope for people who are in comas."
431,"Since in this organization they're all chiefs and no Indians, it's a wonder any decisions get made."
432,"Their influence becomes greater every day, but they are uncreative and can't make value judgements."
433,Tom did everything within his power to save the children that were trapped in the burning building.
434,Tom told Mary that he didn't think it was a good idea for her to go jogging in the park by herself.
435,Giving up smoking is the easiest thing in the world. I know because I've done it thousands of times.
436,I don't quite believe it when I hear someone claim they can speak more than five languages fluently.
437,I think it's unlikely that aliens similar to what we see in the movies have ever visited our planet.
438,"If you spend too much time in the sun without putting on sunscreen, you are likely to get a sunburn."
439,One of the greatest secrets of happiness is moderating your wishes and loving what you already have.
440,"That knife wasn't sharp and I couldn't cut the meat with it, so I resorted to using my pocket knife."
441,There have been a lot of complaints from consumers that our products don't last as long as we claim.
442,Tom was unsure what Mary would be like and he wondered whether she would get along with his friends.
443,"Before I get out of bed, I spend a little time thinking about what I'll be doing the rest of the day."
444,"I looked in my closet for something to wear, but couldn't find anything appropriate for the occasion."
445,"I watched the film named ""Texas Chainsaw Massacre"" with my girlfriend yesterday. She was very afraid."
446,"In order to get some information about Japanese economic problems, you'll find this book very useful."
447,The pledge to stop smoking cigarettes ranks among the top ten New Year's resolutions year after year.
448,Tom did everything within his power to keep Mary from being elected president of the student council.
449,Tom wondered why many people in America think that baseball is more interesting to watch than soccer.
450,"If you're tired, why don't you go to sleep? ""Because if I go to sleep now I will wake up too early."""
451,"A young boy, who couldn't have been more than five years old, asked Tom how to get to the post office."
452,I was just wondering if I could borrow three hundred dollars from you. I can pay you back next Monday.
453,"My father, grandfather, great-grandfather and great-great-grandfather all had the same name as I have."
454,"Some people consider it a waste of time to study languages such as Klingon, Interlingua and Esperanto."
455,The Super Nintendo's graphics are amazing. They're so much better than those of the original Nintendo.
456,The iPad would be a perfect solution for me if it could properly display web pages with Flash content.
457,Tom was determined not to make the same mistakes with his children that his parents had made with him.
458,"When you watch television or listen to the radio, the music which you hear is often African in origin."
459,You should make sure that you get there on time. Tom won't wait more than ten minutes if you are late.
460,"If you're not happy with your purchase, you can return it at any time. ""Could I get that in writing?"""
461,"Disconnect the power cable from the modem, wait for approximately one minute, then reconnect the cable."
462,"I look for all the world like an athlete in this outfit, but the truth is I don't do any sports at all."
463,The attitude of the court toward young criminals is different from its attitude toward adult criminals.
464,There were three hundred cardboard boxes filled with old clothes ready to be sent to the disaster area.
465,Tom felt the stiffness in his joints as he stood up after sitting in the same position for a long time.
466,Tom prefers to take a shower in the morning while Mary prefers to take a bath just before going to bed.
467,"Tom sprang out of bed, threw on some clothes, ate breakfast and was out of the door within ten minutes."
468,"If you'd told me about it earlier, I could've been free. However, tomorrow I have plans to go back home."
469,It takes more time to prepare the car for getting painted than it takes for the actual paint job itself.
470,"On school nights, Tom goes to bed at nine o'clock, but on Fridays and Saturdays, he stays up much later."
471,"Some people think that it is difficult for a native speaker of English to learn Chinese, but I disagree."
472,The world's greatest singers and most of its famous musicians have been fat or at least decidedly plump.
473,Tom and Mary don't have much time to talk together. Their children are always demanding their attention.
474,"Tom thinks he knows how much money Mary makes, but Mary makes quite a bit more than Tom thinks she does."
475,"During hard times, people might not go on a trip, but they might be willing to pay extra for good coffee."
476,"If you watch the sun setting on a warm, damp day, you can see the moisture changing the shape of the sun."
477,"Some superstitious people in America believe that if a black cat crosses your path, you'll have bad luck."
478,"The trouble with the world isn't that people know too little, but they know so many things that ain't so."
479,The worst-case scenario is that Tom will lose his job and won't be able to keep up his mortgage payments.
480,Thomas A. Edison so loves his work that he sleeps an average of less than four hours of each twenty-four.
481,We were unsure what kind of person Tom would be and whether he would like living in the same house as us.
482,"What's important isn't which university you've graduated from, but what you learned while you were there."
483,"If your spouse is a politician, then likely your name will also appear in the newspaper from time to time."
484,"Last year, I spent so much time by myself that I almost forgot how to communicate effectively with others."
485,"Tom asked Mary a few questions that she couldn't answer, but she was able to answer most of his questions."
486,Tom couldn't hear what the teacher was saying because all of the other students were making so much noise.
487,We were unsure what kind of person Tom would be and whether he would like to live in the same house as us.
488,"When I woke up today, I yawned, stretched, rubbed the sleep out of my eyes, and put on a pair of slippers."
489,"Cats are like girls. If they talk to you it's great, but if you try to talk to them, it doesn't go so well."
490,He began to suspect something was wrong when the seller didn't allow him to test the item before buying it.
491,"He got tired of being the devil's advocate and now agrees with every idea they suggest, no matter how dumb."
492,"Incidentally, this room doesn't have anything like an air conditioner. All it has is a hand-held paper fan."
493,"Last year in the Philippines, earthquakes and tidal waves resulted in the deaths of more than 6,000 people."
494,There have been a lot of complaints recently about drivers not obeying the speed limits in downtown Boston.
495,We're gonna make sure that no one is taking advantage of the American people for their own short-term gain.
496,Why did I buy flowers? Is that what you just said? It's really noisy here so I couldn't hear you very well.
497,I like to feel sad. I know that most people try to avoid any kind of sad feeling. But I think that is wrong.
498,I talked with Tom for over an hour before he said something that made me realize he wasn't a native speaker.
499,"Eight years ago, we were in the early stages of what would become the worst economic crisis of our lifetimes."
500,"I don't think it's necessary for me to sound like a native speaker, I just want to be able to speak fluently."
501,"I don't think there is any excuse for his behavior. At the same time, we should listen to what he has to say."
502,"If you don't start treating people with a little more respect, people may start avoiding you like the plague."
503,It is easier for a camel to pass through the eye of a needle than for a rich man to enter the kingdom of God.
504,"It's hard to be a woman. One must think like a man, act like a lady, look like a girl, and work like a horse."
505,A lot of banging and cussing could be heard coming out of the garage when Tom was trying to fix the lawnmower.
506,I can't believe that you aren't at least willing to consider the possibility that there's another explanation.
507,It doesn't make sense to criticize someone for doing something that we would do if we were in their situation.
508,"Masculine qualities in a woman are seen as strength, while feminine qualities in a man are viewed as weakness."
509,"The graphic description of the victim's murder was too much for his mother, who ran out of the court in tears."
510,"Even though Tom told Mary about his problem, he didn't want to listen to any advice she had on how to solve it."
511,"I realize I may not be the most desirable man in the world, but I still hope you'll consider going out with me."
512,"In preparation for painting a portrait, my friend takes many photographs in order to study the subject closely."
513,Life would be infinitely happier if we could only be born at the age of eighty and gradually approach eighteen.
514,"People often lie about what they did on the weekend, so their friends won't realize how boring they really are."
515,Something you should know about me is that my greatest fear in life is that people will find out that I'm poor.
516,Tom pressed his ear against the wall to see if he could hear what his parents were discussing in the next room.
517,"Tom was obsessed by the belief that, one by one, everyone around him was being abducted and replaced by aliens."
518,"I know that it is highly unlikely that you'd ever want to go out with me, but I still need to ask at least once."
519,"Acting on advice from his astronomers, Alexander the Great decided not to attack Egypt and went to India instead."
520,"I came here to see if there was something I could do to help, but there doesn't seem to be anything for me to do."
521,"I know you're upset about your car being totaled, but you weren't injured and you should be thankful to be alive."
522,The World Health Organization says alcohol abuse is the third leading cause of death and disability in the world.
523,"Babies can become dehydrated from a high fever, so I was told that it would be better to send him to the hospital."
524,"Did you know that in Japan, if you have a tattoo, you won't be allowed to bathe in many of the hot spring resorts?"
525,"Everybody has a right to his own opinion. However, sometimes it's better not to tell anybody what that opinion is."
526,The Himalayas were formed by the collision of the tectonic plates of India and Eurasia about 50 million years ago.
527,The police can't find a single person who remembers seeing you where you said you were on the night of the murder.
528,"Tom likes Mary, but Mary likes John. To make matters even more interesting, John likes Alice, but Alice likes Tom."
529,Tom was sad when he discovered that Mary was a gold digger and Mary was sad when she discovered that Tom was poor.
530,What kind of a parent would leave their child unattended in the car outside the pub while they're inside drinking?
531,Witnesses told police that the train was travelling way over the speed limit when it derailed going around a bend.
532,The Belo Monte dam in Brazil is a controversial project because of its impact on the environment and native people.
533,"Tom's constant arguing irritates some of his classmates. However, most of the class has just learned to ignore him."
534,"How's the trouble and strife? is an example of a sentence using Cockney rhyming slang. It means ""How's your wife?"""
535,Getting your message across is much more important than trying to say it exactly like a native speaker would say it.
536,"Over 100 tons of dust and sand-sized particles bombard the earth every day from space, most of which goes unnoticed."
537,The typical elements of a foreign culture are changed into the typical elements of the local culture of translators.
538,"Tom tried to sell his old VCR instead of throwing it away, but no one would buy it, so he ended up throwing it away."
539,A man touched down on the moon. A wall came down in Berlin. A world was connected by our own science and imagination.
540,"Being happy doesn't mean that everything is perfect, but rather that you've decided to look beyond the imperfections."
541,Dr. Zamenhof believed that a language belongs to the people who speak it which is why he never copyrighted Esperanto.
542,Every student who has graduated from our university has studied English with a native speaker for at least two years.
543,"If you don't want to put on sunscreen, that's your problem. Just don't come complaining to me when you get a sunburn."
544,It took Tom several hours to assemble a bunk bed that the instructions said would take less than an hour to assemble.
545,"Nobody has asked you to agree, but can't you at least accept that there are people who hold different views from you?"
546,"Tom didn't know the meaning of ""anglophobia,"" so he did a quick web search to see if he could find out what it meant."
547,"Even though computer programmers may use semicolons every day, nowadays most people only use semicolons for emoticons."
548,"I had never eaten any kind of Thai food, so I was pretty excited about going to a Thai restaurant with my grandmother."
549,"The room didn't look very good after Tom painted it, because he didn't even bother to wash the walls or ceiling first."
550,"When does your sister come back from work? ""I don't know, but I think she'll arrive at home a few minutes before me."""
551,"Four of my favorite Christmas carols are ""Silent Night,"" ""Joy to the World,"" ""The First Noel"" and ""Away in the Manger."""
552,"My friend recommended that I shouldn't buy an iPad yet, but to wait until I see what Apple's competitors come out with."
553,"Roger Miller entered the United States Army at the age of seventeen. He was sent to an army base near Atlanta, Georgia."
554,A trade delegation has gone to Japan ahead of the Prime Minister to crunch the numbers with their Japanese counterparts.
555,"Anyone whose comfort level depends on what someone else is wearing really needs to take a long, hard look at themselves."
556,I think it's highly unlikely that Tom was not aware that he wouldn't be allowed to enter the museum without his parents.
