,0
0,Talk about Tsetse
1,About Us
2,Talk to Us
3,is a public engagement work aimed at bringing awareness on scientific research on sleeping sickness.
4,"A collaboration between the Wellcome Centre for Integrative Parasitology, University of Glasgow School of Life Sciences, Surge, Kamuzu University of Health Sciences and Malawi VOICES."
5,This project is funded by the ScotPEN Wellcome Engagement Award (Wellcome Project Number 217078/Z/19/Z)
6,Recent Posts
7,These are articles that appear in other media platforms about our activities
8,Read More
9,Radio Programs
10,Below are some of the radios that we have partnered with to cover our engagements in Rumphi and Nkhotakota in Malawi. These will run alongside our performances allowing a larger community to engage with the discussions and information available. These radio stations will make available programs that will engage radio listening clubs after live interviews and Questions and Answers
11,Street Theatre
12,"An interactive street theatre performance at local football and netball matches and other places where people gather, for example marketplaces"
13,"Radio interviews and question and answer session on the radio allowing direct communication between researchers, heath workers and local community members"
14,Downloadable Resources
15,"A website of free downloadable resources including information and signposting as well as recordings of radio broadcasts, films and photos of the performances that can be watched or listened to at local events collectively or individually."
16,Read more about the Street Scientists
17,Image Gallery
18,No Image Gallery is available for this post.
19,Please find our different types of media materials
20,Video Resources
21,Got a Question?
22,Got Information to share?
23,Send A Message
24,Enter Message
25,Your message is too short
26,Enter your name
27,Your name is too short
28,Your Email Address
29,This is not a valid email address
30,Enter Subject
31,Please Enter Subject
32,Subject is too short
33,Click on Captcha
34,Pictures
35,More Pictures
36,This project is funded by the
37,Preparing for the Performance
38,The Street Scientists prepare for Dances with the Lugo Dance Group before the engagement at Zolokere
39,Children Prepare to Watch the Performance
40,Children gather at Zolokere Primary School Ground to watch the performance
41,Public Address Van warms up the Place with Music
42,"Lots of dancing when the music started, and dancers showed off their skills"
43,A group of Ladies shows off their Beautiful red Tsetse tshirts and Tsetse Bags
44,A group of ladies shows off the Beautiful red Tsetse tshirts and Tsetse Bags they have received
45,One of the Netball Teams getting ready for the Game
46,One of the Netball Teams shows excitement in their new red tsetse tshirts before they start playing
47,Hannah gets ready to cover the perfomance from the roof of the faithful Toyota Land Cruiser
48,Hannah gets ready with her camera to shoot pictures of the performance
49,The Crowds receive Tsetse T-shirts
50,The Crowds were excited to receive the red Tsetse tshirts
51,The Performance by the Scientists
52,The Scientists mesmerise the Crowd with their performance
53,The Giant Tsetse with its Maggots
54,The Giants Tsetse and its maggots prepare for the performance
55,Kamphenda Football Club in their kit donated by Boness United FC from Scotland
56,as the sun sets over Kamphenda
57,The Street Scientists Line up
58,Preparing for the Perfomance
59,The Performance
60,Part of the Perfomance
61,What a talented man from Sasani!
62,Media Team
63,The Giant Tsetse with its Maggots interact with the Crowd
64,Enjoying the Performance from the Car roof
65,The Crowd answers questions about Tsetse and receive tshirts
66,A Wrap up by the Performers
67,Getting Ready for a Football Game
68,"The team performed in Zolokere on Friday 14th October, 2022, our first outing with the new performance."
69,"We travelled around Rumphi with Lugo Cultural Team, who did an amazing dance and music performance and hosted a question and answer session in each place."
70,We saw the local netball teams play and the football teams The Young Rangers played vs Monga Youth Club; we were very pleased with how many people came to see the first show!
71,"On Saturday 15th October,2022 we took the performance to Kamphenda, where the truck travelled around the area before the event playing music loudly to attract the attention of the local people."
72,It was market day and so again we had a great turn out. Kamphenda played vs KK Rangers in the football match and the local netball teams played a great game too.
73,"On Sunday 16th October,2022, for our last performance in Rumphi we went to the village of Bowe, where we received a warm welcome from local villagers."
74,"On Sunday 16th October,2022, for our last performance in Rumphi we went to the village of Bowe, where we received a warm welcome from local villagers. 
The teachers in each local village were essential in helping us ask the audiences questions about the activities, which will be important for our research. There was a great football match between Bowe vs Betere and the local netball teams played really well too.
This, being our last performance in Rumphi, was very successful and we had lots of good questions about African Trypanosomiasis from the crowd."
75,"On Friday 21st October,2022 in Nkhotakota our team performed with local dancers Chiusi Kanada Dance Group and the Gule Wamkulu dancers, creating an amazing spectacle which drew crowds from the surrounding areas."
76,"Our first performance was in Sasani, as part of a football and netball bonanza, where Bata Sasani played a great game vs Young Stars and our Talk About Tsetses performance was very well received."
77,"We had an extremely warm welcome in Mwala Wa Tongole Saturday 22nd October 2022, when we were greeted with the local villagers singing in harmony as we arrived. 
The local football match between Young Challengers vs Ngala Stars was great; and also netball game between the local teams was exciting. Our performance was well received with good questions from the audience. Our performance was well received with good questions from the audience."
78,"Our last performance of the project took place in Bamba on Sunday 23rd October, 2022 and there was a football match between Mthirah vs Red Rangers and a fantastic local netball match too."
79,Malawi Tour 2022
80,"Our team of performers, scientists, community members and dancers took our newly-developed Talk About Tsetses performance and giant tsetse fly to areas affected by African sleeping sickness in Rumphi and Nkhotakota over a period of 2 weeks in October 2023."
81,Our activities were part of local football and netball bonanzas in villages in the areas and we were joined by dance and music troupes from the local communities. We hosted question and answer session at each performance to encourage conversation about African Trypanosomiasis.
82,Performance at Partick Thistle Stadium
83,"The Street Scientists performed on Saturday, 6 August 2022 at Furhill Stadium, during the half time break of the Scottish Championship Football League game between Partick Thistle Football Club and Hamilton Academical."
84,The performance got a loud ovation from the cheering crowds.
85,"Partick Thistle Chief Executive, Gerry Britton, said: When researchers at the University of Glasgow reached out to us late last season about the prospect of performing an educational street theatre performance ahead of their trip to Malawi, it was a no-brainer for us to give them the platform to rehearse"""
86,"The team is getting set to fly out to Malawi in the coming weeks, where The Parasite Street they will do public engagement work surrounding infectious diseases."
87,"This after engaging the public at the Furhill Stadium, Glasgow, Scotland on Saturday 6 August 2022."
88,"A Special Radio Program on Umunthu FM Radio, on Tsetses, Sleeping Sickness and Street Science featuring Gary Chilinga and Dr Jacob Kafulafula, from Nkhotakota District Health Office."
89,"Hear from Dr Walt Adamson on his experiences on the Street Science performances in Malawi, 2022"
90,Learn from Dr Nicola Veitch on her experiences in the Project.
91,"Get to know the Theatre Director Alan, and his thoughts on the Performances"
92,A Comic Book about Sleeping Sickness
93,A nightmarish parasite capable of disguising itself from the immune system and hiding undetected in the body.
94,"This is a 360 Video. Hence please use your cursor on the Video, or move your phone around if you are viewing on a phone to move round the festival site. The video is best viewed from resolution 1080sHD and above."
95,Our Street Scientists gave the Furhill Stadium football crowd a chance to get involved with learning the science behind the spread of infections and the role of antibodies within the body.
96,Sleeping Sickness: A tale of Shape Shifting Parasites
97,Learn more about the human African trypanosomiasis.
98,"Watch an overview of the public engagements of the Street Scientists in Malawi, particularly in Rumphi and Nkhotakota in October 2022."
99,Talk About Tsetses
100,Let us talk about tsetse flies and their impact on health. This is an public engagement video on tsetse flies and trypanosoma.
101,Please give her your feedback
102,PUBLIC STATEMENT ON THE FUTURE OF MALAWI LEADERSHIP
103,Introduction
104,"Fellow Malawians, it is with great conviction and patriotism for my country, that I have decided to speak on issues that are affecting us all. I say conviction and patriotism for my country because in taking this stand, I am well aware of the associated risks to me personally, my family and my colleagues. However, my personal comfort plays subordinate to the national good. It is on that basis that I have braved to make this statement."
105,"I am inspired by the many brave Malawians who have come before me. From the time of Reverend John Chilembwe to Dr. Kamuzu Banda, who fought against a white establishment for us to attain political independence. I am inspired by the likes of Dr. Bakili Muluzi, late Chakufwa Chihana, late Aleke Banda and all those who braved the one-party system in the early 1990s for us to have democracy. These Malawians knew the risks so well but put the interest of the nation far ahead of their personal interests. If it were not for their sacrifices, perhaps we would until today be under colonial rule or under one-party system. This statement I am making is a fruit of their sacrifices. I am personally indebted to them all."
106,"Malawi is a country well-endowed with natural resources and a predominantly youthful and energetic human resource which unfortunately is currently under- utilized. Malawi has everything required for her people to economically develop except it lacks effective leadership. Our development challenges have remained the same. Economic growth rate remains low, children still learn under a tree, health facilities are poorly resourced, some people have yet to have access to safe drinking water, agriculture is largely rain-fed and subsistence, markets for agricultural produce are weak and unpredictable, few people own houses in urban areas and only few houses in rural areas are permanent, transport system is inefficient and expensive, university students from low income households continue to face the risk of withdrawal on account of lack of tuition fee or upkeep expenses, small and medium enterprises cannot grow because the business environment is less conducive and some districts have yet to have tarmac road until now."
107,"In fact, if one reads the priorities in the 1965 Nyasaland Development Plan and compare with priorities in the Statement of Development Policies in 1970s to mid- 1990s, then read Vision 2020 and then read Malawi 2063, it is clear that our priorities have remained the same. The reason they have remained the same is because they remain challenges because we have not made noticeable improvement as a country. The reason they remain challenges is because no leadership has addressed any key priority exhaustively. We still discuss food insecurity. We still discuss poor access to safe drinking water. We still discuss lack of all-weather roads in some areas. We still discuss poor access to electricity. We still discuss lack of profitable markets for farmers. We still discuss high unemployment especially among the youth."
108,Economy
109,"Fellow Malawians, our economy remains small, vulnerable to shocks and we continue carrying the Least Developed Country label. Even more irritating is that countries which have been at war or in conflict have economies stronger than ours. The weak economy we have is not the make of nature. It is the make of our leaders. While acknowledging periods of progress, such periods have been episodic and short-lived."
110,"Malawi has capacity to feed itself and other countries given its abundant water resources for irrigation. Malawi has capacity to substitute imports and to increase exports and in so doing improve her balance of payments, stabilize exchange rate and contain inflation rate. Malawi has capacity to manage its own budget without heavy borrowing."
111,"Sadly, people we have put in position of power to advance our common interests have opted to pursue personal interests, maintain luxuries and perpetuate the status quo at the expense of common Malawians whom they are meant to serve. There is both outright impunity and institutionalized impunity. An example of institutionalized impunity is the heaping of allowance entitlements to cabinet members and senior government officers when middle and junior level officers continue earning low salaries."
112,We have a system which just fuel allowance entitlement of a cabinet member is worth more than a salary of a Principal Secretary and fuel allowance entitlement of a Principal Secretary is worth more than a salary of a middle level officer. The same is the case in state owned enterprises.
113,"I stand with you; teachers, police officers, healthcare workers, agriculture extension workers and many others whose salary is a fraction of just one allowance entitlement of a senior public officer and a minister. Surely, this is institutionalized impunity and must stop."
114,"I stand with you parents whose children are learning under a tree. I stand with you families who are struggling to put food on the table. I stand with you families whose sick relatives are sent back from hospital without receiving treatment. I stand with you, university students, who are struggling to meet upkeep expenses. I stand with you who are looking for a job which you are not able to find. I stand with you farmers who have been at subsistence level without hope of growing to a higher level. Your next government will stand with you. It will be a government whose job is to offer solutions and will address the challenges you are facing. You can count on me."
115,"Fellow Malawians, I believe in the potential of our country and in Malawians. We read positive stories about economic success of Rwanda. Zambia has just changed narrative since their current government came in office later than our current government and we are hearing positive stories. There is no reason other than poor leadership, that stories for Malawi that make international news headlines are poverty, hunger and corruption involving high profile public officers."
116,"I feel the pain we are all going through in the tough economic times. I acknowledge that part of the reasons for the economic challenges are external factors such as a war in Ukraine and tropical cyclones. However, as I have said time and again in various media interviews, the external factors have just contributed. A large part of the challenges is our own making. The past national budgets by the current political administration were poorly prepared, not transformative and did not build foundation for macroeconomic stability. I said it in 2020 and have consistently said this. The problems we are going through were anticipated and I did not keep quiet, I shared my views then."
117,"The fast-rising public debt is testimony of lack of fiscal discipline. We were reminded a month ago that every Malawian is carrying on our shoulders a debt burden of K600,000. Unfortunately, this is not debt that financed programs to improve the living standard of us all. This is debt that financed corruption and luxury of senior officers. There has been limited interest to reform the fiscal plan – to remove or reduce unnecessary expenditure items and to grow the revenue base by increasing resource allocation to productive sectors. Additionally, there has been high level inefficiency in government resulting in delays to approve projects. The State President himself and some ministers have admitted this in public. Delay to approve projects locks up foreign exchange since most projects are donor- funded, delays job opportunities and delays development outcomes. These are the main reasons we are going through difficult times. If the leadership was up to task, the extent of suffering would be less than is the case."
118,"My colleagues and I come to offer genuine transformation. Malawi is a natural resource-rich and labour-abundant economy. Our economic policy will revolve around maximizing the potential in agriculture, mining, tourism and developing the human resource both in its own right and as catalysts for manufacturing. This will be done while progressively moving towards a knowledge economy by investing in science and technology."
119,"I will implement Malawi 2063 in its entirety. I am happy to inform you, fellow Malawians, that Malawi 2063 is a document I intimately subscribe to, because I was one of the reviewers. I also co-reviewed the enabler on enhanced public sector performance in the Malawi 2063 first 10 years Implementation Plan. My being identified as a person who could review this enabler is testimony that I understand the public service and I know how to make it perform. When I say I will implement it fully, I know what is in the document and I have adequate passion to implement it. I emphasize I because the responsibility for implementing a strategic plan in any organization is vested in the head of the organization. What makes a strategy work for one organization and fail for the other organization, is the quality of leadership of the organization. I will provide quality leadership."
120,"We will transform agriculture through Mega farms and cooperatives which will facilitate mechanization, improve productivity, promote access to reliable markets for farmers, catalyze industrialization and urbanization. We will embark on infrastructure revolution agenda. From electricity generation, transport and ICT to residential and government office buildings."
121,"We will decisively support micro, small and medium enterprises. We will identify those which Malawi has comparative and competitive advantage to produce and have niche markets in the region and prioritize support to them. One key performance indicator for the Ministry of Industrialization and Trade will be the number of micro-scale enterprises graduating into small-scale; the number of small-scale enterprises graduating into medium-scale; the number of medium-scale graduating into large-scale annually. We will encourage and support Malawian large-scale enterprises to become multinational corporations. We denounce the glorification of the MSME concept as if that is the ideal destiny for them. They will be helped to grow."
122,"There are four main ways in which a country can benefit from its extractive resources which include mining. These are i) royalties, ii) resource rent iii) State participation and iv) taxes. So far, the component of State participation has not been exploited despite being the most beneficial way. To maximize benefits from mining, government will establish a Mining Company that will be getting into Joint Venture arrangement with foreign companies. Joint Venture arrangements will enable Malawians to be in management team and in the Board of Directors, thereby directly participating in running mining business and curb transfer pricing and other forms of illicit financial flows that often happen in mining industry. Your next government will review tax incentives to ensure Malawians get a fair share of their natural resources."
123,"We will approach tourism holistically and contextually. Tourism is about attraction. We will invest in areas that are unique to Malawi, one of them is establishing vibrant cultural centers and packaging our history into a commercial product. Tourism is a beneficiary of derived demand. Our resolve to develop the economy, develop manufacturing sector will positively contribute to the travel and tourism industry. We will make Malawi a destination for citizens of neighboring countries to come and shop. As they come, they will need accommodation and transport just as Malawians do when they travel outside."
124,"Agriculture transformation, infrastructure revolution, growing of MSMEs, mining, industrialization (manufacturing) and tourism will anchor our job creation agenda."
125,"My fellow Malawians, I am aware of the key drivers of cost of living. We will overhaul the fuel procurement system in the short-term while investing in cost- effective mode of transport such as rail and pipeline in line with the Malawi National Transport Master Plan. We will review all levies and remove or reduce those that can be done so without compromising public service delivery. We will work to achieve macroeconomic stability with a stable and relatively strong currency to contain imported inflation. In line with Malawi 2063, we will enhance agricultural productivity so that price of food is cheap while farmers still make profit."
126,We will embark on an ambitious home ownership program in which Malawi Housing Corporation will be recapitalized so it can build houses of different designs to suit your affordability. You will be paying monthly rental fee but which will be going towards purchase of the house. We will make home ownership easy for everyone. A well-thought housing scheme will be implemented in rural areas.
127,"My fellow Malawians, our approach to improving living standards focuses on containing cost of living on one hand and improving incomes on the other hand while investing in physical and human capital development to put a solid foundation for economic development. That is what your next government will do."
128,"Public debt management will be key in getting the economy back on right track. Our resolve to decisively end corruption will free up resources and reduce the need for borrowing. Estimates based on previous government financial audits showed that 30% of the national budget is unaccounted for. When the system is fixed, we will save these funds and spend on intended projects. Our resolve to reform the fiscal plan so we remove unnecessary expenditure and we grow revenue base will reduce the need for borrowing. Reform of foreign missions will free up resources. Where we will have to borrow for legitimate reasons, these questions will guide in determining the source of borrowing; 1) will the loan help grow economy (GDP)? 2) will the loan help either grow tax revenue or reduce expenditure or both? 3) will the loan help grow exports? If the answer is NO especially to 2 and 3, no external loan will be contracted. If a loan still has to be secured, it will be domestic and using a long-term development bond."
129,"Reducing debt will feed into stimulating private sector development as commercial banks and other lenders will have enough liquidity to lend to private sector at competitive interest rates. Your next government will commit to clearing payment arrears as one way of capacitating private sector to operate fully, expand production and create additional jobs."
130,Corruption
131,"Corruption is a developmental challenge. It is a political campaign issue. Every leader promises to end corruption during political campaign yet corruption continues to worsen. Recent revelations of corruption are evident that our leaders are not only failing to end corruption, they are in fact participating in it."
132,"A large part of our poverty is due to corruption. We have had leaders who amass wealth for themselves through corruption and morally questionable entitlements and give us leftovers. Citizens have systematically been economically disempowered so we can depend on them. They use the same corruptly acquired wealth, stolen from the many taxes we pay, to coax us to side with them when they are caught on the wrong side of the law. They project a picture that any criminal investigation in their dealings is the work of their political rivals. We fight on their behalf even when they were the first to kill us through denying us access to education, healthcare, food and job and business opportunities."
133,"Malawi has enough financial resources to deliver public services adequately. Publicly available information confirm that it is possible to run a government without heavy borrowing. For example, it is alleged that in one contract, a business person charged government US$10,524,000 for goods that cost the business person US$2,165,700 making abnormal profit of US$8,358,300. Surely this is over- pricing and stealing from poor Malawians."
