,0
517,"Tom anadzadzidwa ndi zikhulupiliro zoti, modzi, modzi munthu womuzungulira amabedwa ndi kuikapo mlowammalo wa zukwa."
518,"Ndikudziwa kuti ndi mochuluka zedi kusatheka kuti uzayenda nane, komabe ndikufuna ndikufunse kamodzi kokha."
519,"Pochita zomwe omphunzira za nyenyezi anamuuza, Alexander wamkuluyo anaganiza osachita topola ndi dziko la Aigupto mmalo mwake anachitila topola dziko la India"
520,"Ndinabwera kuno kuti ndione ngati pali china chilichonse chomwe ndingathandize, koma palibe chomwe ndingachite kuti ndithandize."
521,"Ndikudziwa kuti wasokonekera mutu ndi galimoto yako mmene yawonongekera, koma sunavulale ndipo uziyamika kuti uli moyo."
522,Bungwe lowona zaumoyo padziko lonse lapansi lanena kuti kumwa mowa mwa uchidakwa ndi chithu chachitatu chomwe chikupha athu ndi ulumali.
523,"Tiana tikhoza kukhala ndi madzi ochepa nthupi chifukwa cha litsipa, ndiye ndinauzidwa kuti ndi kwabwino kutengera mwana ku chipatala."
524,"Mumadziwa kodi kuti ku Japan, ngati uli ndi zojambula pathupi lanu, simuloledwa kusamba ma hotel."
525,"Aliyense ali ndi ufulu ku maganizo ake. ngakhale zili chocho, ndi kwabwino kusanena maganizo ako."
526,Himalayas inapangidwa pomwe mbale zapansi za ku India ndi Eurasia zitakhulana pansi.
527,Apolice sangapeze wina aliyense amene akukumbukira kukuonani inu komwe munati munali mu usiku wa kupha.
528,"Tom amakonda Mary, koma Mary amakonda John. Kupangitsa kuti zithu zimveke modabwitsa, John amakonda Alice koma Alice amakonda Tom."
529,Tom anadandaula atazindikira kuti Mary ndi opempha zedi ndipo Mary anadandaula atadziwa kuti Tom ndi osauka.
530,Ndi kholo la mtundu wanji lomwe lingasiye mwana wawo mu galimoto osamusamala panja ma malo omwera mowa iwo akumwa mowa mu bala.
531,Mboni zinauza a police kuti sitima imathamanga kwambiri kuposera mlingo wake pomwe imafika popendeka.
532,Project ya Dam Monte ku Brazil ndizovuta kuvetsa chifukwa za zotsatira zake pa zachilengedwe komanso anthu ozungulira malowa.
533,"Kutsutsatsuka kwa Tom zomwe zimapangitsa ena aziboweka naye kalasi. komabe, ambiri a mukalasi yake anamuzolowera."
534,"Mavuto ndi kukangana zili pati? Ndichitsanzo cha chiganizo chogwiritsidwa ntchito ndi Cockney rhyming slang. kutathauza ""mkazi wako ali bwanji"""
535,Kuyankhula moveka bwino kwa womvetsera ndi chofunika zedi kusiyana ndi kuyesetsa kuyakhula ngati unabadwa nacho chiyankhulocho.
536,"Fumbi loposera mazana amatani ndi tithu tokula ngati mchenga zimagwa padziko tsiku lina lililonse kuchokera mlengalenga. Zambiri za izo, sizidziwidwa."
537,Zokhudza eni ake a chikhalidwe chogobwera zasithidwa kukhala chikhalidwe cha wathu ogochilandira.
538,"Tom anayesera kugulitsa VCR yake yakale malo mogoitaya, koma palibe amene agaigule. chocho anagothela kuyitayabe."
539,Munthu anafika pa mwenzi. Khoma linatsika ku Berlin. dziko linalumikizidwa ndi sayasi yathu komanso maganizo athu.
540,"Kukhala osangalala sikukutathauza kuti zonse zili bwino ndi iwe, koma kuti wasankha kuyang'ana kupyola zotsamwitsa."
541,Dr. Zamenhof amakhulupilira kuti chiyankhulo ndi cha aeni akewo omwe amachidziwa ichi ndi chifukwa chake sanakopere chiyankhulo cha Esperanto.
542,"Wophunzira wina aliyense pa university yathu amene anaphunzira za chiyankhulo cha chingerezi, anaphunzitsidwa ndi athu omwe akhala zaka ziwiri akuyakhula bwino lomwe."
543,"Ngati sukufuna kuvala ma sunscreen, ilo ndi vuto lanu. Osazabwera kuzadandaula chifukwa chomwe muli ndi zilonda zodza kamba ka dzuwa."
544,Zinamutengera Tom maola angapo kuti akwanitse kukonzanso kama zomwe olemba analemba kuti zimatenga mphindi zosachepera ola limodzi.
545,"Palibe wakufunsani kuti muvomereze, komabe simugavomereze kuti pali athu omwe ali ndi maganizo osiyana ndinu?"
546,"Tom samadziwa tathauzo la ""anglophobia"". kotero anafufuza mwasanga patsamba la internet kuti aone ngati angapeze tathauzo lake."
547,"Angakhale okonza zama pologalamu apa kompyuta amagwiritsa ntchito semikoloni tsiku lina lililonse, makono ano, athu amagwiritsa ntchito semicolony ngati fuuliro."
548,"Sindinadyepo chakudya chilichonse cha Thai, kotero ndinali osangalala kupita ku restaurant yomwe amagulitsa chakudya cha Thai ndi agogo anga akazi"
549,"Chipindacho simunaoneke bwino komwe atamaliza Tom kuika utoto, chifukwa iye sanavutike ndi kusasa zipupa komanso siling'i."
550,"Chemwali wako amabwera nthawi yanji kuchokera kuntchito? ""Sindikudziwa, komabe akhala akufika mphindi zochepa kuposera ine"""
551,"Nyimbo zinayi za christmas zomwe ndimazikonda ndi ""Usiku wabata"", ""Chimwemwe kudziko"", ""Noel woyamba"", ""mu chodyera ng'ombe""."
552,"Mzanga anaikira mang'ombe kuti ndisagule iPad tsopano, koma kuti ndidikire mpakan nditaona zomwe a Apple atatulutse."
553,Roger Miller analowa gulu la nkhondo la United States ali ndi zaka 17 zakubadwa. anatumizidwa kumalo okhala asilikali kufupi ndiku Antlanta Geogia.
554,Gulu la zamalonda lapita ku Japan pomwe nduna yaikulu ikukatsutsa ma nambala azamalonda azawo.
555,Aliyense yemwe chisangalalo chake chimatengera kuona zomwe wina wavala akusowekera kwambiri kuziganizira yekha.
556,Ndikuganiza kuti sizoyenera kuti Tom samadziwa kuti sagaloledwe kulowa mu malo osungira za mbiri yamake dzana opanda makolo ake.
557,Ndinali ndi mwayi kuti apolice sanandipatse chiphaso choti ndiganize zobwerera pa chithu cchomwe sizikanatheka kubwerera mbuyo.
558,Tom simzako pa chilichose. Sakonda zomwe achinyamata ambiri amakonda komanso sakonda zomwe amuna ambiri amakonda kuchita ndikusangala nazo.
559,Cesar Chavez anafunsa ma strikers kuti akhale bata angakhale eni ake a munda ndi owatsatira amagwiritsa ntchito zipolowe.
560,"Angakhale tsopano, ndimafuna nditakuona iweyo nthawi zina. Osati iweyo amene uli tsopano, koma iweyo wa nthawi imene inja."
561,Tipereke nthawi yathu kupeza zoti tiike pa website yathu kusiyana ndikutaya nthawi kudandaula ndi zithu zazing'ono.
562,Athu ambiri omwe kufika tsopano akhala akuwononga ndalama kumakhala ndi nthawi yabwino tsopano akuyenera kukhala osamalitsa ndi ndalama zawo.
563,Ndikosamvuta kumveka weniweni mu chiyakhulo chako chobandwa nacho kusiyana ndi kumveka weniweni mu chiyakhulo choti wagochipeza.
564,Kusiyana pakati pa mau olondola ndi mau okhala ngati olondola ndi kusiyana pakati pa mphenzi ndi
565,"Chigerezi chanu ndi cholondola ndithu, koma nthawi zina zina mwa zomwe mumanena sizimveka ngati muthu wobadwira mu chiyankhulochi."
566,Ndili ndi azinzanga a chijapani ndi achitchaina omwe amayankhulana mu chiyankhulo cha chingerezi poti ndi chiyankhulo chokhacho chomwe angayankhulilane.
567,"Zomwe adokotala ananena ndi zakuti ndisamamwe coffee, koma, angakhale ananena chocho, ndimamwabe ndikakhala ndi gulu lomwe likumwa."
568,Masulirani bwino chiganizo chomwe mukumasulira. Musalore kumasulira kodza kamba ka ziyankhulo zina kusokoneze kumasulilaku.
569,Chithu chimodzi chomwe sindikonda chokhudzana ndi iPad ndi chakuti zimavuta kuika app ina yomwe mu app store mulibe.
570,"Jingle Bells, nyimbo yontchuka mu nyengo ya christmas, si nyimbo yokhudza christmas. zoyimba zake sizikhudza komwe christmas."
571,"Ndikakonda kuonera kanema wa anime kwambiri pamene ndinali mwana, koma sindingakumbukire chimene chinachitikira katswiriyo mu kanema womaliza."
572,"Ngati kapmani yanu imapanga malonda ndi America, ndiye ndikofunika kuti muzimphunzira chiyankhulo cha chingerezi ndi anthu omwe anabadwa nacho chilankhulochi ku America"
573,Chiyankhulo chachingerezi ndichosakayikitsa kuti ndi chophweka komanso pa nthawi yomweyo choyenera polumikizana pa dziko lonse lapansi.
574,"M'malo mopatsana mphantso za christimas za chaka chino, tinapereka katundu/ndalama zomwe tinakapangira zimenezi ngati zachikondi kwa ena."
575,"Woyimba komanso wazisunzo Selena Gomez anayamba zimenezi ali ndi zaka zisanu ndi ziwiri pa program ya children's public television show ""Barney and Friends."""
576,"Wolemba nkhani ma newspaper wabwino amatengera mwayi wophunzira kuchokera pa zilizonse zomuzungulira, angakhale ""mbalame yaing'ono inamuuza chocho"" pochokera nkhani."
577,Mitengo ya zakudya yakwera zedi kuchokera pomwe United Nations Food and Agriculture anayamba kusunga kalembera mu 1990
578,Ndinamva kuti ndizosatheka kuyankhula ngati mwini chiyankhulo pokhapokha atayamba asanakwanitse zaka nkhumi ndi ziwiri.
579,"Kaya ndiwe katswiri wanji pa ntchito yako, kapena mmene mulili osangala mu ntchito yanuyo. pali nthawi zina pomwe umaona ngati unasakha ntchito yolakwika."
580,"Pamene Tom anali mwana, akatolera zotsatira za fodya yemwe bambo ake akasuta mpakana zikakwana kupanga fodya wake-wake wosuta"
581,Zowunikira zikugwiritsidwa ntchito pa nyanja ya India ndi cholinga chofuna kuwonetsetsa malo ena ake pa nyanjayi pomwe zawoneka kuti pali zithu zina zomwe zikuyandama pa malopo.
582,"Wokondedwa, ndikudziwa kuti dongosolo la zachuma lovutirapo, komabe mukuganiza kuti tikhoza kukhwefula pang'ono ndikupita ku restaurate yapamwamba kumapeto kwa sabatali usiku?"
583,"Tom anapita kwa wabwebwe/olosera ku town fair ndipo anauzidwa kuti wina wake abwera moyo mwake wa dzina loyambira chilembo ""M""."
584,"Komiti ndi gulu la wathu lomwe modzimodzi mwa iwo sangapange kathu, koma ngati gulu akhoza kukumana ndi kupanga kathu."
585,"Oh theradi, ndinaphunzira chizungu mu masiku anga a sukulu. Koma sipanatengere zaka ziwiri kapena zitatu zapitazo pomwe ndinayamba kuzitengera zenizeni."
586,"Mu chaka cha 1964, Roger Miller anavomera kutulutsa nyimbo 16. Imodzi mwa nyimbozo inali ""Dang me"" inali nyimbo yomwe anagulitsa kwambiri"
587,"Tom watenga nthawi asanachape zovala zake, kotelo anayang'ana mu zovala zake zakuda kuti apeze ngati mungapezeke zoyererako kuti avale"
588,Njira imodzi yochepetsera zolakwika mu Tatoeba Corpus ndikulimbikitsa aliyense kumasulira mu chiyankhulo chobadwa nacho.
589,"Ndikufuna chipemphezo cholemekeza kusiyana komwe kulipo pakati pa wathu, komanso chomwe chimanena kuti aliyense ali ndi mbali yake ngati munthu payenkha."
590,"Anali ndi chibwenzi chake chomwe amayenda nacho kuyambira ku secondary sukulu, koma akumverera kuti ubwenzi wawo wavuta. Kotero wakhala wosaukitsika."
591,"Nthawi zonse gwiritsani ntchito madzi okozedwa bwino lomwe mu makina owongola zovala chifukwa kugwiritsa ntchito madzi wamba, kumapangitsa kutseka ma bowo omwe makinawa amakhala nawo kamba ka zomwe madziwa amapanga."
592,Ndikuona ngati ndi zamanyazi kuti amphunzitsi ochokera maiko akunja anamaliza mamphunziro awo ku koleji opanda olo ndi kamodzi komwe kuphunzitsidwa ndi badwa za derali.
593,"Ukhoza kupusisa athu wena nthawi zonse, ndipo athu onse mu nthawi ina. komabe sugapusitse athu onse nthawi zonse."
594,"Ngati umasulira chiyankhulo chako chachiwiri kuchokera mu chiyankhulo chobadwa nacho, kusiyana ndi mbali inayo. ndi povuta kupanga zolakwika."
595,"Athu amayakhula kwambiri zofunika kusiya dziko labwino kwa ana athu, Sitiganiza zosiya ana abwino ku dziko lathu."
596,Nduna ya ikulu yanena kuti sakuganizira zolowetsapo kuyankhulana mwa mkweza mawu ndi dziko la Aigupto chifukwa cha mtolankhani yemwe anamagidwa wachi Austraria
597,"Simugaphunzire kuyakhula ngati eni ake a chiyankhulo, koma uyenera kutha kuyankhula moti eni chiyankhulo ndi kumvetsa zomwe ukuyankhula"
598,"Ngati muthu analephera kuphunzira chiyankhulo adakali mwana, ndi kovuta kuti azayakhule ngati mwini chiyakhulo atakula."
599,"Ndikovutabe kupeza ntchito. Angakhale utapeza ntchito, mwayi omwe uli nawo"
600,"Ndikovuta kuyika zithunzi pa iPad kuchokera pa ma kompyuta oposera imodzi. Ngakhale zili chochobe, ukhoza kutumiza zithunzi zako kwa iwe mwini kugwiritsa ntchito email yako kuchokera ma kompyuta angapo ndikuzitsitsa kugwiritsa ntchito iPad imodzi."
601,"Sungaone zithu zamu fulashi kugwiritsa ntchito iPad. Ngakhale zili chocho, ukhoza kuzitumizira wekha mosavuta kumatsamba amenewa ndikuziona zithuzo kugwiritsa ntchito kompyuta ina utafika kunyumba."
602,Kulakwitsa komwe achinyamata amachita nthawi zambiri ndi kuyamba kumphunzira ziyankhulo zambiri mu nthwi imodzi akuchepetsa zovuta komanso kukulitsa lutha lawo
603,Angakhale mutanena kosalekeza kuwamemeza athu kuti chocolate ndi vanilla. chikhalabe chocolate. Angakhale mutakwanitsa kuvomereza ndi azizanu ndi vanilla.
604,"Mu 1969, Roger Miller anatulutsa nyimbo mutu wake ""Sufuna chikondi changa"". lero, nyimboyi imadziwika bwino kuti ""its summer time"". Ndi nyimbo yoyamba yomwe analemba ndi kuyimba koyamaba."
605,Mwana wobadwira mu chiyankhulo nthawi zambiri amadziwa zochuluka za chiyankhulocho kusiyana ndi munthu yemwe wakhala akuphunzira chiyankhulocho kwa zaka zochuluka koma zoti saziwa ndipo sazadziwa bwino lomwe.
606,"Pali njira zinayi zodzetsa imfa kamba ka kumwa mowa, ngozi yapamsewu kapena chipolowe. nkhansa ya chiwindi, khansa, matenda a mtima ndi kayendedwe ka magazi thupi ndi zinanso mwa izo"
607,"Pali azimayi ndi azibambo omwe akhalabe asanagone panthawi yomwe ana awo agona ndikuganizira mmene agaperekere ngongole zawo, kapena ma bilu akuchipatala, kapena kusunga ndalama za mamphunziro za ana awo ku kolenji."
608,"Carbon footprint ndi kuchuluka kwa mpweya oyipa omwe omwe wawononga omwe timaupanga kuchokera mu zopanga zathu, Athu ena amachepetsa kupanga mpweyawu poganizira kusintha kwa nyengo."
609,"Poti pali ma tsmaba ambiri a internate pa nkhani ina iliyonse yaperekedwa, nthawi zambiri ndimagodina batani la mbuyo pa webu ina iliyonse ndalowapo lomwe likulengeza. Ndimagopita pa tsamba lotsatilallo lapelekedwa ndi google, ndikuona pamenepo kuti pakhoza kukhala zobowa zochepelako."
610,"Ngati ukufuna kumveka ngati bamdwa ya chiyankhulo, ukuyenera kumabwereza kunena ngati chiganizo chomwechomwecho ngagapo konse ngati mmene oyimba banja amachitira pobwerza pamkana pomwepomwepo mpakana atayimba moyenera ndi kutulutsa moyenerera."
611,"Tom anavulala bondo lake lakumamzere akuyeserera, kotero John amayenera kusewera masewerowo mmalo mwake."
612,"Tom anamukonda Mary kwa zaka, koma pa nthawi ina, ma mverero ake anasitha kukhala kungwa chikondi."
613,Tom anati anaganiza kuti kukhala kulakwitsa kwakukulu kumuuza Mary zomwe zinachitika.
614,"Tom anatenga zithunzi za zikwi ku ntchuthi kwake, komabe sanazionenso komwe."
615,Tom akufuna kugula choyimba kasanu ndi katatu kuti ayike mu galimoto yomwe anamupatsa agogo ake.
616,"Mmene ndinawayendera komwe amakhala, iwo anali ali mkatimkati mokangana."
617,"Ndili ndi zaka nkhumi, ndikaganiza kuti ndizakakwana zaka nkhumi zisanu ndi chimodzi, moyo wanga uzakhala pabwino."
618,Ulemu wa munthu uzitengera nkhalidwe lake osati udindo wake mu mdera.
619,"Ndikazagopeza kamera yabwino yojambula video, ndizayamba kutulutsa ma vedio pa internate."
620,"Pathawi yangoziyo, pafupifupi onse anali mu basiyo anali akugona."
621,"Chifukwa mau a wathu opanga zionetserowo anali okwera-kwerera, zoyakhula zake sizimamveka."
622,"Amphaka sakonda, Nkhumba ndi zamanjenje, ndipo agalu amafuna chikondi pafupipafupi ndi kusamalidwa."
623,Akastwiri anena kuti mitengo ya coffee ikukwerera-kwerera chifukwa athu ali ololera kupereka zambiri.
624,"Kunena mwantchuntchuntchu, ana a kolenji ali ndi nthawi yoseweretsa yambiri kusiyana ndi ana a ku secondadry."
625,Anabadwa muthu wachifundo ndipo ndi odziwika ndi ana omuzungulira mderali.
626,"Ndinakakhala kanthawi ndithu, koma ndimadzimva kutopa, kotero ndinaganiza zonyamuka."
627,"Ndili ndi azizanga ambiri omwe amayankhula bwino lomwe , komabe samveka ngati eni chiyankhulo."
628,Ndimakhala ndi nthawi yambiri yogwira ntchito munda tsiku limodzi pomwe chimwene wanga amapanga mu sabata lathuthu.
629,Ndidakali ndi mafunso ambiri oti ndikufunseni zokhudza ubwenzi wanu ndi Tom.
630,Ndinakuuzani kuti ndi zoopysaa. Ndi chifukwa chake wavulala chifukwa sunandimvere.
631,"Ndikuganiza zopita kwina kwake poduka mphepo, ma dokotala anandilangiza choncho."
632,"Ngati suchita zomwe ndakuuza kuti uchite, sindikgakhale woyankhira pa zotsatira zake."
633,"Mu kalasi yathu yotsatira, tikamphunzira masiku a pa sabata, miyezi, ndiponso nyengo."
634,"Mu U.S, simulandu kuzunza athu ndi cholinga chofuna kutolera umboni kwa iwo."
635,Zopangapanga zinafulumizitsa chitukuko pa chuma dziko la Japan.
636,Insecticides ndi mankhwala a ulimi opagidwa ndi ma kemiko ofuna kuthana ndi zoononga zomera.
637,"Kunazizira nyengo yotentha yapitayi, ndipo mbeu ya mpunga sinachite bwino zaka nkhumi zapita."
638,Samadziwa amene analemba buku lomwe amawerenga kufikira mmene anamaliza kuwerenga bukulo.
639,Agogo anga akazi amkagwiritsa ntchito makina osokora kwambiri kufikira zaka zitatu zapitazo.
640,"Kusategera kuti ndi athu angati amuuza kuti akulakwitsa, Tom amaumililabe kuti amalondola."
641,"Posachedwapa ndimamverera otopa, kotero sindinapite kosambira mu sabatayi."
642,Athu 60 pa 100 iliyonse akulu ku Japan amuna amamwa zokumwa zoledzeretsa mwa nthawi iliyonse.
643,"Athu ena amabweretsa chimwemwe kuli konse angapite, ndipo athu ena amabweretsa chimwemwe paliponse angapite."
644,"Nyengo ya ku Mangalande siposa yaku Japani, koma mu chilimwe, kumazizira."
645,"Nthawi yambiri yomwe umakhala ukuyankhula zomwe ukuchita, ndi nthawi yochepa yomwe umakhala nayo yochitadi."
646,Mwini wake wa malo odyera anamulola kuti atenge zakudya zotsala kuti akadyetse agalu ake onse.
647,"Pali njira zingapo zozitetezera ku mayesero, koma yabwino ndi kuopa."
648,Muli makina osokera ndi thabwa loikapo simbi powongola zovala mu chipinda chomwe Tom akagonamo.
649,Pakufunika mwasanga kumvetsetsa mmene kusintha kwa nyengo kuzatikhudzire miyoyo yathu.
650,"Nthawi ino, mayeso sanagovuta kokha, komanso osamvetsetseka."
651,Kamwana kakamuna ka Tom ndi Mary kamakonda kukhala pansi ku kitchini ndikumaimba mapoto ndi ma pani.
652,Tom anamufunsa Mary kuti atenge mankhwala otsukira kamwa ndinso ma pepala akuchimbudzi pa supermarket.
653,Tom anatopa nazo nthawi zonse chifukwa cholipira zomwe agwiritsa ntchito akangoyenda ndi Mary.
654,Tom amakhulupilira kuti olemera ndi oyenera kukhala olemera ndiponso osauka ndi woyenera kukhala osauka.
655,Tom mwa theradi anali ndi mwayi wonse opita ku zokawonera nthawi yomwe anali ku Boston.
656,Tom theradi amaoneka komanso kumveka bwinonoko kusiyana ndi mwenzi watha mmene tinamuyendera iye.
657,Tom anagoyankhula mwa ntchutchutchu pamene ananena kuti gulu lathu likusowa chidwi ndi kulimbikitsidwa.
658,Tom amafuna Mary amuyankhule John zokhudza mavuto amakumana nawo a ana ake.
659,Tom anagamulidwa kukakhala mu ndende masiku asanu komanso chaka chifukwa choyendetsa galimoto anamwa mowa.
660,Tikufunika katswiri wofufuza kuti atipezere muthu pa ntchito yoyendetsa pa udindowu.
661,"Mmene anabwerera, anagula chikho cha baseball ndikumpatsa mzake ngati mphatso."
662,"Atachotsedwa ntchito, amkalemphera kudyetsa agalu ake, kotero anawapereka kwa ena."
663,"Pozafika nthawi ngati ino mchaka cha mawa, uzakhala utayendera malo onse ontchuka ku Japan."
664,China yaletsa zoulika mmwamba kudutsa malo mwawo chifukwa cha kusephana maganizo pa zilumba zomwe zili kummawa kwa nyanja yaikulu ya China.
665,Sakufuna kutuluka mu chipindamo chifukwa akuopa kuti akazizidwanso akagotuluka.
666,Anamphunzira za sayansi poganizira kuti ndi zofunika kwambiri mu zaka zama 19 century.
667,"Galimoto yake ikhoza kukhala yosangalatsa kuyendetsa, koma ndiyodula kuikonzanso."
668,"Ndikudziwa kuti mwakhala mukudikira kanthawi ndithu, komabe mugadikire kanthawi kochepa?"
669,Ndinakhumudwa kuti chikozero chinalipo chinandikanizitsa ine kulandira kuyitana kwanu.
670,"Ndimaganiza ngati tinadya zonse nyumbamo, koma ndinapeza bokosi lama bisiketi."
671,Ndakhala ndikusaukitsidwa maganizo kuti ndichite zomwe Tom amaganiza kapena zomwe Mary amaganiza.
672,"Ngati mkazi wanga angayimbe lamya, ungomuuza kuti ndili mu msonkhano ofunikira ndipo sindigasokonezedwe."
673,"Ngati ukufuna china chake chichitike molondola, nthawi zina kumagofunika kuti uchite iwe mwini."
674,Ndi zoona kuti obwera mophwanya malamulo akugwira ntchito zomwe eni nthaka akuzifuna?
675,Zinagochitika mwa mwayi kuti onse Tom ndi Mary anali mu malo odyera pa nthawi imodzi.
676,"Anamulangiza kuti akakumane ndi katswiri wa za mano, koma anati alibe nthawi yokwanira kutero."
677,Anamugulira galu. Komabe sakonda agalu. chocho anagopereka kwa ena.
678,Zopulumutsira pa ngozi pa nyanja zinali zokwanira theka kwa iwo anakwera Titanic.
679,Mphunzitsi wa team analimbikitsa osewera kuti asatailire potsatira kupambana kwawo kanayi motsogozana.
680,Aini ake a Kampani ndi kagulu ka wathu omwe ndi a malonda omwe anayamba itagotha nkhondo.
681,"Tsiku lotsatira nditapita ku gym, malo wena a thupi mwanga amapweteka moti sindimadziwa kuti ndinapwetekeka."
682,Malo owerengera omwe ali pafupi ndi nyumba yanga atsegulidwa tsopano koma masiku atatu okha pa sabata chifukwa choperewera kwa ndalama.
683,Oyendetsa pomalizira anagonjera ku zofuna za ogwira ntchito ndipo awawonjezera malipilo.
684,"Ukayang'ana kwambiri, ndi kwambirinso mmene uonere, ndinso zimaoneka zosangalatsa kwambiri."
685,Mazana awiri anatoleledwa muma sukulu a zaumoyo dziko lonse.
686,Tom ndi Mary anali ali mkati mokangana kwambiri pamene John analowa mu chipindacho.
687,Tom amakhulupilira kuti mwa theradi ndikofunika kumwa lita imoodzi ya madzi tsiku lina lililonse.
688,Tom anagulira Mary kachitsulo ka manja ka chikole kuchokera ku ndalama zomwe anapatsidwa ndi agogo ake amuna.
689,"Tom amalimbikira kuti sawonera kwambiri kanema, koma amaonera kwambiri ma ola atatu tsiku lina lililonse."
690,Tom alibe zovala zambiri. Ndichifukwa chake mumamuona akuvala zovala zomwezomwezo.
691,Tom anapeza mafupa mosungira zithu mmene amayang'ana mbiri ya banja lake.
692,"Tom amaseka nthabwala za Mary, koma anaganiza kuti zina mwa izo sizinali nthabwala zoseketsa kwenikweni."
693,Tom anapilira ndi kuwawa komwe amamva masabata angapo asanapite pamapeto ake ku chipatala.
694,Tom anakhala pansi ndikuyang'anitsitsa nthawi yaitali nsomba za tropical zikusambira mu aqurium ku chipinda chake.
695,"Tom anakhalabe kuti awone chomwe chichitike. mwatsoka lake, anayenera kuchokapo"
696,Tom anamuchenjeza Mary kuti John siwabwino koma mavuto. Komabe iye sanamvere kuchenjezaku.
697,Makolo a Tom sakufuna kuti Tom ndi Mary akhalire malo amodzi pokhapokha atakwatirana.
698,Alendo nthawi zambiri amauzidwa kuti avule nsapato zawo asanalowe nyumba za ma Japanese.
699,"Chifukwa chiyani zoona zimakhala zodabwitsa kusiyana ndi nkhani zogopeka?. Zogopeka, mwa zonse, ziyenera kupereka tathauzo."
700,"Ndi omphunzira ambiri akucheza, zinali zovuta kuti umve zomwe a professor amafuna kunena."
701,Ukuyenera kutaya nthawi kuchita zithu zomwe zingathandize ana ako kupita patsogolo mu moyo wawo.
702,"Tiyeni tipite koonera kanema nthawi ina. ""Chomwe chikukupangitsa kuti kuzakhala nthawi ina ndi chani?"""
703,"Kamwana sikatha kuyankhula, chocho kamagofuula mpakana kapeze zomwe kakufuna."
704,"Pa malirowo, nafedwa amaoneka wokhudzidwa kwambiri, atavala suite yake yokuda, chipewa ndima golovu mmanja."
705,"Abambo, tiyeni tiyang'anizane ndipo tione amene akhoza kukhala osaseka kwa nthawi yaitali."
706,Ukuganiza kuti ukhoza kukwanitsa kupambana mwini chiyakhulo kuti ukhale wofufuza wachinsinsi wabwino?
707,"Kuyankhula mwa ntchuntchuntchu, ife a chijapani ndiotsalira pomphunzira ziyankhulo za maiko ena."
708,Anayakhula momveka bwino kuti alibe maganizo ofuna kuzakhala katswiri wa mpira wamiyendo.
709,"Anagadamutsa botolo ndikugwedeza, komabe uchi sunatuluke."
710,Sindikudziwa kuti ndipanga nae chiyani mphaka wanga poti ndikupita ku dziko lina.
711,Ndikufuna nditengerepo mwayi pa nthawiyi kuthokoza inu nonse pololerana.
712,"Ngati athu omwe amasuta achotsedwera fodya wosuta, amankhala amanjenje komanso okhumudwa."
713,"Ngati ukufuna kumva nkhani zochititsa tsemwe, ndikuuzani za maloto omwe ndinali nawo ma sabata apitawo."
714,"Ku London, apolice nthawi zonse amadandaula ndikupeza bomba pa sitima kapena njira zokumbidwa pansi pa nthaka momwe sitima zimadutsa."
715,"Mu kuyenda kwanga konse, sindinaonepo Phiri lokongola ngati la Mount Everest."
716,"Mu maiko ambiri, chifukwa chachikulu chomwe athu amapita mizinda ikuluikulu ndi chifukwa cha ntchito."
717,"Zikhoza kuoneka ngati maganizo opepera, koma ndikuganiza kuti tipite tikayendere Tom ndi Mary pompano."
718,Unali utagotha mkumano omwe anapanga ku America pomwe anapanga ganizo kulemba buku la wathu osakonda za sayansi.
719,Anali masiku asanu atamaliza mamphunzi a ukachenjede mwana wanga wakazi anachoka ku bwalo la ndege la Osaka ndikupita ku Germany.
720,"Azimayi ndi Azimbabo, chifukwa cha ngozi yachitika pa bwalo la ndenge, kufika kwathu kuchedwerapo."
721,Mulipiliretu malo a ndenge mofulumira malowa asanathe chifukwa amatha mofulumira mu nyengo ya christmas.
722,Zika zambiri za ku japan zimakhala ndi vuto lokumva kusiyana kwa B ndi V.
723,Chikondi changa pa iwe sichingandilole kukuuza china chilichonse. Zithu zina zofunika kuzisiya osazinena.
724,Ogwira ntchito mu ndege amapereka malo ogona kwa ma kasitomala omwe asowekera ngati njira imodzi yosangalatsa makasitomala awo.
725,Katundu yemwe bambo anga anasiya pomwe anafa anasanduka opanda ntchito.
726,"Bombalo linaphulitsa nyumba ya Tom kusanduka zidutswa. Mwayi wake, iye sanali ku nyumba nthawi imeneyi."
727,Kuwerenga kwa omphunzira omwe anachedwa ku sukulu chinali chiwerengero chochepa kusiyana ndi mmene ndinaganizira.
728,Nkhalamba yomwe inali pa chikuku inandiuza kuti anawadziwa mayi anga pamene anali ndi zaka zama tini.
729,Kuchuluka mwa dzidzidzi kwa ma galimoto kukupangitsa ngozi kuchuluka pa msewu tsiku lina lililonse.
730,Palibe dziko lina lililonse lomwe chivomezi chimagwedeza pafupipafupi ngati dziko la Japan.
731,Nthawi zambiri amadya kadzutsa hafu pasiti seveni ndipo amadya nkhomalilo 12 koloko.
732,"Tom ndi Mary onse amafuna kupita ku Boston, koma palibe mwa iwo amafuna kugotaya nthawi chabe."
733,Tom amaoneka ndi kumwetulira pa nkhope ya Mary kuti anali ndi nthawi yopambana pa madyerero.
734,Tom sanakamalizitsa kuti kuti pali kuthekera kochotsedwa ku ntchito.
735,Tom ndi mwamuna yemwe Mary wasangalatsidwa naye kuchokera pomwe anasiyana ndi John.
736,Tom amayimba nyimbo zachisipanishi kugwiritsa ntchito nyanga yachigerezi pa malo odyera achi chinese ku France.
